{
 "schemaVersion": 1,
 "type": "persons",
 "id": "53",
 "updatedAt": "2026-10-18T11:25:22Z",
 "persons": {
  "p.abubakr-barry.2000": {
   "id": "p.abubakr-barry.2000",
   "name": {
    "full": "Abubakr Barry",
    "first": "Abubakr",
    "last": "Barry"
   },
   "birthDate": "2000-07-02",
   "nationalities": [
    "GM"
   ],
   "isCuban": false,
   "gender": "M",
   "body": {
    "heightCm": 190.5,
    "weightKg": null
   },
   "externalIds": {
    "espn": "386242"
   },
   "sources": [
    "espn"
   ]
  },
  "p.adonija-bryan-ouanda": {
   "id": "p.adonija-bryan-ouanda",
   "name": {
    "full": "Adonija Bryan Ouanda",
    "first": "Adonija Bryan",
    "last": "Ouanda"
   },
   "isCuban": false,
   "gender": "M",
   "externalIds": {
    "espn": "3098598"
   },
   "sources": [
    "espn"
   ]
  },
  "p.adrian-gombau": {
   "id": "p.adrian-gombau",
   "name": {
    "full": "Adrian Gombau"
   },
   "nationalities": [
    "ES"
   ],
   "isCuban": false,
   "gender": "M",
   "sources": [
    "wbcboxing"
   ]
  },
  "p.ahmad-ali-hazimeh": {
   "id": "p.ahmad-ali-hazimeh",
   "name": {
    "full": "Ahmad Ali Hazimeh"
   },
   "nationalities": [
    "LB"
   ],
   "isCuban": false,
   "externalIds": {
    "fide": "5325650"
   },
   "sources": [
    "lichess"
   ],
   "extra": {
    "federation": "LBN"
   }
  },
  "p.amadeo-zazueta.1986": {
   "id": "p.amadeo-zazueta.1986",
   "name": {
    "full": "Amadeo Zazueta",
    "first": "Amadeo",
    "last": "Zazueta"
   },
   "birthDate": "1986-01-31",
   "birthPlace": {
    "city": "Culican",
    "country": "MX"
   },
   "isCuban": false,
   "body": {
    "heightCm": 177.8,
    "weightKg": 72.6
   },
   "hand": {
    "bats": "R",
    "throws": "R"
   },
   "externalIds": {
    "mlb": "469117"
   },
   "sources": [
    "mlb-statsapi"
   ]
  },
  "p.amador-arias.2000": {
   "id": "p.amador-arias.2000",
   "name": {
    "full": "Amador Arias",
    "first": "Amador",
    "last": "Arias"
   },
   "birthDate": "2000-08-25",
   "birthPlace": {
    "city": "Maracay",
    "country": "VE"
   },
   "isCuban": false,
   "body": {
    "heightCm": 180.3,
    "weightKg": 64.9
   },
   "hand": {
    "bats": "R",
    "throws": "R"
   },
   "externalIds": {
    "mlb": "672457"
   },
   "sources": [
    "mlb-statsapi"
   ]
  },
  "p.amadou-cisse.2006": {
   "id": "p.amadou-cisse.2006",
   "name": {
    "full": "Amadou Cissé",
    "first": "Amadou",
    "last": "Cissé"
   },
   "birthDate": "2006-02-27",
   "nationalities": [
    "GN"
   ],
   "isCuban": false,
   "gender": "M",
   "body": {
    "heightCm": 182.9,
    "weightKg": 73.0
   },
   "externalIds": {
    "espn": "397220"
   },
   "sources": [
    "espn"
   ]
  },
  "p.andres-reyes.1999": {
   "id": "p.andres-reyes.1999",
   "name": {
    "full": "Andrés Reyes",
    "first": "Andrés",
    "last": "Reyes"
   },
   "birthDate": "1999-09-08",
   "nationalities": [
    "CO"
   ],
   "isCuban": false,
   "gender": "M",
   "body": {
    "heightCm": 190.5,
    "weightKg": 81.2
   },
   "externalIds": {
    "espn": "182014"
   },
   "sources": [
    "espn"
   ]
  },
  "p.andriy-lunin.1999": {
   "id": "p.andriy-lunin.1999",
   "name": {
    "full": "Andriy Lunin",
    "first": "Andriy",
    "last": "Lunin"
   },
   "birthDate": "1999-02-11",
   "nationalities": [
    "UA"
   ],
   "isCuban": false,
   "gender": "M",
   "body": {
    "heightCm": 190.5,
    "weightKg": 78.9
   },
   "externalIds": {
    "espn": "257237"
   },
   "sources": [
    "espn"
   ]
  },
  "p.angel-stringa.1996": {
   "id": "p.angel-stringa.1996",
   "name": {
    "full": "Ángel Stringa",
    "first": "Ángel",
    "last": "Stringa"
   },
   "birthDate": "1996-04-06",
   "nationalities": [
    "AR"
   ],
   "isCuban": false,
   "gender": "M",
   "body": {
    "heightCm": 177.8,
    "weightKg": 73.9
   },
   "externalIds": {
    "espn": "335528"
   },
   "sources": [
    "espn"
   ]
  },
  "p.ariel-hernandez.1992": {
   "id": "p.ariel-hernandez.1992",
   "name": {
    "full": "Ariel Hernández",
    "first": "Ariel",
    "last": "Hernández"
   },
   "birthDate": "1992-03-02",
   "birthPlace": {
    "city": "Santo Domingo",
    "country": "DO"
   },
   "isCuban": false,
   "nickname": "El Fai",
   "body": {
    "heightCm": 193.0,
    "weightKg": 104.3
   },
   "hand": {
    "bats": "R",
    "throws": "R"
   },
   "externalIds": {
    "mlb": "554374"
   },
   "sources": [
    "mlb-statsapi"
   ]
  },
  "p.arthur-piedfort.2005": {
   "id": "p.arthur-piedfort.2005",
   "name": {
    "full": "Arthur Piedfort",
    "first": "Arthur",
    "last": "Piedfort"
   },
   "birthDate": "2005-02-01",
   "nationalities": [
    "BE"
   ],
   "isCuban": false,
   "gender": "M",
   "body": {
    "heightCm": 185.4,
    "weightKg": 68.9
   },
   "externalIds": {
    "espn": "359360"
   },
   "sources": [
    "espn"
   ]
  },
  "p.avyukt-dasgupta": {
   "id": "p.avyukt-dasgupta",
   "name": {
    "full": "Avyukt Dasgupta"
   },
   "nationalities": [
    "GB"
   ],
   "isCuban": false,
   "title": "CM",
   "externalIds": {
    "fide": "480630"
   },
   "sources": [
    "lichess"
   ],
   "extra": {
    "federation": "ENG"
   }
  },
  "p.aymen-assab": {
   "id": "p.aymen-assab",
   "name": {
    "full": "Aymen Assab",
    "first": "Aymen",
    "last": "Assab"
   },
   "isCuban": false,
   "gender": "M",
   "externalIds": {
    "espn": "3124793"
   },
   "sources": [
    "espn"
   ]
  },
  "p.benjamin-henrichs.1997": {
   "id": "p.benjamin-henrichs.1997",
   "name": {
    "full": "Benjamin Henrichs",
    "first": "Benjamin",
    "last": "Henrichs"
   },
   "birthDate": "1997-02-23",
   "nationalities": [
    "DE"
   ],
   "isCuban": false,
   "gender": "M",
   "body": {
    "heightCm": 182.9,
    "weightKg": 78.0
   },
   "externalIds": {
    "espn": "220711"
   },
   "sources": [
    "espn"
   ]
  },
  "p.berland-robles": {
   "id": "p.berland-robles",
   "name": {
    "full": "Berland Robles"
   },
   "nationalities": [
    "PH"
   ],
   "isCuban": false,
   "gender": "M",
   "sources": [
    "wbcboxing"
   ]
  },
  "p.brandon-brennan.1991": {
   "id": "p.brandon-brennan.1991",
   "name": {
    "full": "Brandon Brennan",
    "first": "Brandon",
    "last": "Brennan"
   },
   "birthDate": "1991-07-26",
   "birthPlace": {
    "city": "Mission Viejo",
    "country": "US"
   },
   "isCuban": false,
   "nickname": "B2",
   "body": {
    "heightCm": 193.0,
    "weightKg": 93.9
   },
   "hand": {
    "bats": "R",
    "throws": "R"
   },
   "externalIds": {
    "mlb": "592165"
   },
   "sources": [
    "mlb-statsapi"
   ]
  },
  "p.brandon-mechele.1993": {
   "id": "p.brandon-mechele.1993",
   "name": {
    "full": "Brandon Mechele",
    "first": "Brandon",
    "last": "Mechele"
   },
   "birthDate": "1993-01-28",
   "nationalities": [
    "BE"
   ],
   "isCuban": false,
   "gender": "M",
   "body": {
    "heightCm": 190.5,
    "weightKg": 78.0
   },
   "externalIds": {
    "espn": "191222"
   },
   "sources": [
    "espn"
   ]
  },
  "p.cade-gotta.1991": {
   "id": "p.cade-gotta.1991",
   "name": {
    "full": "Cade Gotta",
    "first": "Cade",
    "last": "Gotta"
   },
   "birthDate": "1991-08-01",
   "birthPlace": {
    "city": "San Diego",
    "country": "US"
   },
   "isCuban": false,
   "body": {
    "heightCm": 193.0,
    "weightKg": 93.0
   },
   "hand": {
    "bats": "R",
    "throws": "R"
   },
   "externalIds": {
    "mlb": "657598"
   },
   "sources": [
    "mlb-statsapi"
   ]
  },
  "p.carlos-mendoza": {
   "id": "p.carlos-mendoza",
   "name": {
    "full": "Carlos Mendoza"
   },
   "isCuban": false,
   "externalIds": {
    "mlb": "425825"
   },
   "sources": [
    "mlb-statsapi"
   ]
  },
  "p.celil-yuksel.1998": {
   "id": "p.celil-yuksel.1998",
   "name": {
    "full": "Celil Yuksel",
    "first": "Celil",
    "last": "Yuksel"
   },
   "birthDate": "1998-01-01",
   "nationalities": [
    "TR"
   ],
   "isCuban": false,
   "gender": "M",
   "body": {
    "heightCm": 170.2,
    "weightKg": 63.1
   },
   "externalIds": {
    "espn": "272734"
   },
   "sources": [
    "espn"
   ]
  },
  "p.celina-agwu": {
   "id": "p.celina-agwu",
   "name": {
    "full": "Celina Agwu"
   },
   "nationalities": [
    "NG"
   ],
   "isCuban": false,
   "gender": "F",
   "sources": [
    "wbcboxing"
   ]
  },
  "p.charlie-gaffney.2003": {
   "id": "p.charlie-gaffney.2003",
   "name": {
    "full": "Charlie Gaffney",
    "first": "Charlie",
    "last": "Gaffney"
   },
   "birthDate": "2003-07-29",
   "nationalities": [
    "US"
   ],
   "isCuban": false,
   "gender": "M",
   "body": {
    "heightCm": 175.3,
    "weightKg": 68.0
   },
   "externalIds": {
    "espn": "401231"
   },
   "sources": [
    "espn"
   ]
  },
  "p.christian-walton.1995": {
   "id": "p.christian-walton.1995",
   "name": {
    "full": "Christian Walton",
    "first": "Christian",
    "last": "Walton"
   },
   "birthDate": "1995-11-09",
   "nationalities": [
    "GB"
   ],
   "isCuban": false,
   "gender": "M",
   "body": {
    "heightCm": 195.6,
    "weightKg": 73.9
   },
   "externalIds": {
    "espn": "168746"
   },
   "sources": [
    "espn"
   ]
  },
  "p.clemente-alvarez": {
   "id": "p.clemente-alvarez",
   "name": {
    "full": "Clemente Alvarez"
   },
   "isCuban": false,
   "externalIds": {
    "mlb": "345593"
   },
   "sources": [
    "mlb-statsapi"
   ]
  },
  "p.craig-yoho.1999": {
   "id": "p.craig-yoho.1999",
   "name": {
    "full": "Craig Yoho",
    "first": "Craig",
    "last": "Yoho"
   },
   "birthDate": "1999-10-23",
   "birthPlace": {
    "city": "Fishers",
    "country": "US"
   },
   "isCuban": false,
   "body": {
    "heightCm": 188.0,
    "weightKg": 107.5
   },
   "hand": {
    "bats": "R",
    "throws": "R"
   },
   "externalIds": {
    "mlb": "684974"
   },
   "sources": [
    "mlb-statsapi"
   ]
  },
  "p.cristian-mateo-diaz-moreno": {
   "id": "p.cristian-mateo-diaz-moreno",
   "name": {
    "full": "Cristian Mateo Díaz Moreno",
    "first": "Cristian Mateo",
    "last": "Díaz Moreno"
   },